{
  "card_dsl": [
    {
      "cost": "unknown",
      "effects": [
        {
          "op": "stub",
          "source": "phase1-seed"
        }
      ],
      "target": "unknown",
      "token": "card:StrikeSilent",
      "type": "stub"
    },
    {
      "cost": "unknown",
      "effects": [
        {
          "op": "stub",
          "source": "phase1-seed"
        }
      ],
      "target": "unknown",
      "token": "card:DefendSilent",
      "type": "stub"
    },
    {
      "cost": "unknown",
      "effects": [
        {
          "op": "stub",
          "source": "phase1-seed"
        }
      ],
      "target": "unknown",
      "token": "card:Neutralize",
      "type": "stub"
    },
    {
      "cost": "unknown",
      "effects": [
        {
          "op": "stub",
          "source": "phase1-seed"
        }
      ],
      "target": "unknown",
      "token": "card:Survivor",
      "type": "stub"
    },
    {
      "cost": "unknown",
      "effects": [
        {
          "op": "stub",
          "source": "phase1-seed"
        }
      ],
      "target": "unknown",
      "token": "card:Slice",
      "type": "stub"
    },
    {
      "cost": "unknown",
      "effects": [
        {
          "op": "stub",
          "source": "phase1-seed"
        }
      ],
      "target": "unknown",
      "token": "card:DeadlyPoison",
      "type": "stub"
    },
    {
      "cost": "unknown",
      "effects": [
        {
          "op": "stub",
          "source": "phase1-seed"
        }
      ],
      "target": "unknown",
      "token": "card:Backflip",
      "type": "stub"
    },
    {
      "cost": "unknown",
      "effects": [
        {
          "op": "stub",
          "source": "phase1-seed"
        }
      ],
      "target": "unknown",
      "token": "card:Acrobatics",
      "type": "stub"
    },
    {
      "cost": "unknown",
      "effects": [
        {
          "op": "stub",
          "source": "phase1-seed"
        }
      ],
      "target": "unknown",
      "token": "card:DodgeAndRoll",
      "type": "stub"
    },
    {
      "cost": "unknown",
      "effects": [
        {
          "op": "stub",
          "source": "phase1-seed"
        }
      ],
      "target": "unknown",
      "token": "card:Abrasive",
      "type": "stub"
    },
    {
      "cost": "unknown",
      "effects": [
        {
          "op": "stub",
          "source": "phase1-seed"
        }
      ],
      "target": "unknown",
      "token": "card:Accelerant",
      "type": "stub"
    },
    {
      "cost": "unknown",
      "effects": [
        {
          "op": "stub",
          "source": "phase1-seed"
        }
      ],
      "target": "unknown",
      "token": "card:Accuracy",
      "type": "stub"
    },
    {
      "cost": "unknown",
      "effects": [
        {
          "op": "stub",
          "source": "phase1-seed"
        }
      ],
      "target": "unknown",
      "token": "card:Adrenaline",
      "type": "stub"
    },
    {
      "cost": "unknown",
      "effects": [
        {
          "op": "stub",
          "source": "phase1-seed"
        }
      ],
      "target": "unknown",
      "token": "card:Afterimage",
      "type": "stub"
    },
    {
      "cost": "unknown",
      "effects": [
        {
          "op": "stub",
          "source": "phase1-seed"
        }
      ],
      "target": "unknown",
      "token": "card:Anticipate",
      "type": "stub"
    },
    {
      "cost": "unknown",
      "effects": [
        {
          "op": "stub",
          "source": "phase1-seed"
        }
      ],
      "target": "unknown",
      "token": "card:Assassinate",
      "type": "stub"
    },
    {
      "cost": "unknown",
      "effects": [
        {
          "op": "stub",
          "source": "phase1-seed"
        }
      ],
      "target": "unknown",
      "token": "card:Backstab",
      "type": "stub"
    },
    {
      "cost": "unknown",
      "effects": [
        {
          "op": "stub",
          "source": "phase1-seed"
        }
      ],
      "target": "unknown",
      "token": "card:BladeOfInk",
      "type": "stub"
    },
    {
      "cost": "unknown",
      "effects": [
        {
          "op": "stub",
          "source": "phase1-seed"
        }
      ],
      "target": "unknown",
      "token": "card:BladeDance",
      "type": "stub"
    },
    {
      "cost": "unknown",
      "effects": [
        {
          "op": "stub",
          "source": "phase1-seed"
        }
      ],
      "target": "unknown",
      "token": "card:Blur",
      "type": "stub"
    },
    {
      "cost": "unknown",
      "effects": [
        {
          "op": "stub",
          "source": "phase1-seed"
        }
      ],
      "target": "unknown",
      "token": "card:BouncingFlask",
      "type": "stub"
    },
    {
      "cost": "unknown",
      "effects": [
        {
          "op": "stub",
          "source": "phase1-seed"
        }
      ],
      "target": "unknown",
      "token": "card:BubbleBubble",
      "type": "stub"
    },
    {
      "cost": "unknown",
      "effects": [
        {
          "op": "stub",
          "source": "phase1-seed"
        }
      ],
      "target": "unknown",
      "token": "card:BulletTime",
      "type": "stub"
    },
    {
      "cost": "unknown",
      "effects": [
        {
          "op": "stub",
          "source": "phase1-seed"
        }
      ],
      "target": "unknown",
      "token": "card:Burst",
      "type": "stub"
    },
    {
      "cost": "unknown",
      "effects": [
        {
          "op": "stub",
          "source": "phase1-seed"
        }
      ],
      "target": "unknown",
      "token": "card:CalculatedGamble",
      "type": "stub"
    },
    {
      "cost": "unknown",
      "effects": [
        {
          "op": "stub",
          "source": "phase1-seed"
        }
      ],
      "target": "unknown",
      "token": "card:CloakAndDagger",
      "type": "stub"
    },
    {
      "cost": "unknown",
      "effects": [
        {
          "op": "stub",
          "source": "phase1-seed"
        }
      ],
      "target": "unknown",
      "token": "card:CorrosiveWave",
      "type": "stub"
    },
    {
      "cost": "unknown",
      "effects": [
        {
          "op": "stub",
          "source": "phase1-seed"
        }
      ],
      "target": "unknown",
      "token": "card:DaggerSpray",
      "type": "stub"
    },
    {
      "cost": "unknown",
      "effects": [
        {
          "op": "stub",
          "source": "phase1-seed"
        }
      ],
      "target": "unknown",
      "token": "card:DaggerThrow",
      "type": "stub"
    },
    {
      "cost": "unknown",
      "effects": [
        {
          "op": "stub",
          "source": "phase1-seed"
        }
      ],
      "target": "unknown",
      "token": "card:Dash",
      "type": "stub"
    },
    {
      "cost": "unknown",
      "effects": [
        {
          "op": "stub",
          "source": "phase1-seed"
        }
      ],
      "target": "unknown",
      "token": "card:Deflect",
      "type": "stub"
    },
    {
      "cost": "unknown",
      "effects": [
        {
          "op": "stub",
          "source": "phase1-seed"
        }
      ],
      "target": "unknown",
      "token": "card:EchoingSlash",
      "type": "stub"
    },
    {
      "cost": "unknown",
      "effects": [
        {
          "op": "stub",
          "source": "phase1-seed"
        }
      ],
      "target": "unknown",
      "token": "card:Envenom",
      "type": "stub"
    },
    {
      "cost": "unknown",
      "effects": [
        {
          "op": "stub",
          "source": "phase1-seed"
        }
      ],
      "target": "unknown",
      "token": "card:EscapePlan",
      "type": "stub"
    },
    {
      "cost": "unknown",
      "effects": [
        {
          "op": "stub",
          "source": "phase1-seed"
        }
      ],
      "target": "unknown",
      "token": "card:Expertise",
      "type": "stub"
    },
    {
      "cost": "unknown",
      "effects": [
        {
          "op": "stub",
          "source": "phase1-seed"
        }
      ],
      "target": "unknown",
      "token": "card:Expose",
      "type": "stub"
    },
    {
      "cost": "unknown",
      "effects": [
        {
          "op": "stub",
          "source": "phase1-seed"
        }
      ],
      "target": "unknown",
      "token": "card:FanOfKnives",
      "type": "stub"
    },
    {
      "cost": "unknown",
      "effects": [
        {
          "op": "stub",
          "source": "phase1-seed"
        }
      ],
      "target": "unknown",
      "token": "card:Finisher",
      "type": "stub"
    },
    {
      "cost": "unknown",
      "effects": [
        {
          "op": "stub",
          "source": "phase1-seed"
        }
      ],
      "target": "unknown",
      "token": "card:Flanking",
      "type": "stub"
    },
    {
      "cost": "unknown",
      "effects": [
        {
          "op": "stub",
          "source": "phase1-seed"
        }
      ],
      "target": "unknown",
      "token": "card:Flechettes",
      "type": "stub"
    },
    {
      "cost": "unknown",
      "effects": [
        {
          "op": "stub",
          "source": "phase1-seed"
        }
      ],
      "target": "unknown",
      "token": "card:FlickFlack",
      "type": "stub"
    },
    {
      "cost": "unknown",
      "effects": [
        {
          "op": "stub",
          "source": "phase1-seed"
        }
      ],
      "target": "unknown",
      "token": "card:FollowThrough",
      "type": "stub"
    },
    {
      "cost": "unknown",
      "effects": [
        {
          "op": "stub",
          "source": "phase1-seed"
        }
      ],
      "target": "unknown",
      "token": "card:Footwork",
      "type": "stub"
    },
    {
      "cost": "unknown",
      "effects": [
        {
          "op": "stub",
          "source": "phase1-seed"
        }
      ],
      "target": "unknown",
      "token": "card:GrandFinale",
      "type": "stub"
    },
    {
      "cost": "unknown",
      "effects": [